{
    "batch_size": 1500,
    "description": "Mutliclass csv dataset for unit testing",
    "epochs": 100,
    "format_version": "0.2.0",
    "model_architecture": {
        "args": {
            "num_classes": 3
        },
        "module": "juneberry.architectures.pytorch.sample_tabular_nn.MultiClassModel"
    },
    "platform": "pytorch",
    "pytorch": {
        "loss_fn": "torch.nn.CrossEntropyLoss",
        "optimizer_args": {
            "lr": 1.0
        },
        "optimizer_fn": "torch.optim.SGD"
    },
    "seed": 4210592948,
    "task": "classification",
    "timestamp": "2021-03-01T10:00:00",
    "training_dataset_config_path": "models/tabular_multiclass_sample/train_data_config.json",
    "validation": {
        "algorithm": "from_file",
        "arguments": {
            "file_path": "models/tabular_multiclass_sample/val_data_config.json"
        }
    }
}