{
    "batch_size": 4,
    "description": "Trains an object detector with MMDetection using the Sample TextDetection data set.",
    "epochs": 15,
    "evaluation_metrics": [
        {
            "fqcn": "juneberry.metrics.metrics.Coco",
            "kwargs": {
                "iou_threshold": 0.5,
                "max_det": 100,
                "tqdm": false
            },
            "formatter": {
                "fqcn": "juneberry.metrics.format.Coco",
                "kwargs": {
                }
            }
        }
    ],
    "evaluation_transforms": [],
    "evaluator": {
        "fqcn": "juneberry.mmdetection.evaluator.Evaluator"
    },
    "format_version": "0.2.0",
    "mmdetection": {
        "load_from": "https://download.openmmlab.com/mmdetection/v2.0/faster_rcnn/faster_rcnn_r50_caffe_dc5_mstrain_1x_coco/faster_rcnn_r50_caffe_dc5_mstrain_1x_coco_20201028_233851-b33d21b9.pth",
        "overrides": {
            "model.roi_head.bbox_head.num_classes": 3,
            "optimizer.lr": 0.0025
        }
    },
    "model_architecture": {
        "module": "faster_rcnn/faster_rcnn_r50_caffe_fpn_mstrain_1x_coco.py"
    },
    "platform": "mmdetection",
    "pytorch": {
        "deterministic": true
    },
    "seed": 4210592948,
    "task": "objectDetection",
    "timestamp": "2021-03-03T10:00:00",
    "trainer": {
        "fqcn": "juneberry.mmdetection.trainer.MMDTrainer"
    },
    "training_dataset_config_path": "data_sets/text_detect_train.json",
    "training_transforms": [],
    "validation": {
        "algorithm": "random_fraction",
        "arguments": {
            "fraction": 0.2,
            "seed": 3554237221
        }
    }
}