{
    "batch_size": 4,
    "description": "Unit test for an object detector on the TextDetection data set.",
    "detectron2": {
        "overrides": [
            "SOLVER.BASE_LR",
            0.0025,
            "SOLVER.REFERENCE_WORLD_SIZE",
            1
        ]
    },
    "epochs": 1,
    "evaluation_metrics": [
       {
           "fqcn": "juneberry.metrics.metrics.Coco",
           "kwargs": {
               "iou_threshold": 0.5,
               "max_det": 100,
               "tqdm": false
           },
           "opt_args": {
             "formatter": {
               "fqcn": "juneberry.metrics.format.Coco",
               "kwargs": {
               }
             }
           }
       }
    ],
    "evaluation_transforms": [],
    "evaluator": {
        "fqcn": "juneberry.detectron2.evaluator.Evaluator"
    },
    "format_version": "0.2.0",
    "model_architecture": {
        "args": {
            "num_classes": 3
        },
        "module": "COCO-Detection/faster_rcnn_R_50_FPN_1x.yaml"
    },
    "platform": "detectron2",
    "pytorch": {
        "deterministic": true
    },
    "seed": 4210592948,
    "task": "objectDetection",
    "timestamp": "2021-03-03T10:00:00",
    "trainer": {
        "fqcn": "juneberry.detectron2.trainer.Detectron2Trainer"
    },
    "training_dataset_config_path": "data_sets/text_detect_val.json",
    "training_transforms": [],
    "validation": {
        "algorithm": "random_fraction",
        "arguments": {
            "fraction": 0.2,
            "seed": 3554237221
        }
    }
}
