{
    "batch_size": 4,
    "description": "Trains an object detector using the Sample TextDetection data set.",
    "detectron2": {
        "overrides": [
            "SOLVER.BASE_LR",
            0.0025,
            "SOLVER.REFERENCE_WORLD_SIZE",
            1
        ]
    },
    "epochs": 15,
    "evaluation_transforms": [
        {
            "fqcn": "juneberry.detectron2.transforms.DT2Logger",
            "kwargs": {
                "msg": "eval"
            }
        }
    ],
    "format_version": "0.2.0",
    "model_architecture": {
        "args": {
            "num_classes": 3
        },
        "module": "COCO-Detection/faster_rcnn_R_50_FPN_3x.yaml"
    },
    "platform": "detectron2",
    "pytorch": {
        "deterministic": true
    },
    "seed": 4210592948,
    "task": "objectDetection",
    "timestamp": "2021-03-03T10:00:00",
    "training_dataset_config_path": "data_sets/text_detect_train.json",
    "training_transforms": [
        {
            "fqcn": "juneberry.detectron2.transforms.DT2Logger",
            "kwargs": {
                "msg": "train"
            }
        }
    ],
    "validation": {
        "algorithm": "from_file",
        "arguments": {
            "file_path": "data_sets/text_detect_val.json"
        }
    }
}