{
    "batch_size": 20,
    "description": "Unit test using a pretrained tensorflow resnet50 model with small dataset.",
    "epochs": 5,
    "evaluation_transforms": [
        {
            "fqcn": "juneberry.transforms.image.ResizePad",
            "kwargs": { "height": 224, "width": 224 }
        },
        {
            "fqcn": "juneberry.transforms.image.ConvertMode",
            "kwargs": { "mode": "RGB" }
        },
        {
            "fqcn": "juneberry.transforms.debugging_transforms.SizeCheckImageTransform",
            "kwargs": { "height": 224, "mode": "RGB", "width": 224 }
        }
    ],
    "evaluator": {
        "fqcn": "juneberry.tensorflow.evaluation.evaluator.Evaluator"
    },
    "format_version": "0.2.0",
    "label_mapping": "data_sets/label_mappings/imagenet.json",
    "model_architecture": {
        "args": {
            "channels": 3,
            "img_height": 224,
            "img_width": 224,
            "num_classes": 1000
        },
        "module": "juneberry.architectures.tensorflow.resnet_pretrained_reference.Resnet50Pretrained"
    },
    "platform": "tensorflow",
    "tensorflow": {
        "loss_fn": "tensorflow.keras.losses.SparseCategoricalCrossentropy",
        "metrics": [ "accuracy" ],
        "optimizer_args": {
            "learning_rate": 0.01
        },
        "optimizer_fn": "tensorflow.keras.optimizers.SGD"
    },
    "seed": 4210592948,
    "task": "classification",
    "timestamp": "2021-03-02T13:30:00",
    "training_dataset_config_path": "data_sets/imagenette_unit_train.json",
    "training_transforms": [
        {
            "fqcn": "juneberry.transforms.image.ResizePad",
            "kwargs": { "height": 224, "width": 224 }
        },
        {
            "fqcn": "juneberry.transforms.image.ConvertMode",
            "kwargs": { "mode": "RGB" }
        },
        {
            "fqcn": "juneberry.transforms.debugging_transforms.SizeCheckImageTransform",
            "kwargs": { "height": 224, "mode": "RGB", "width": 224 }
        }
    ],
    "validation": {
        "algorithm": "random_fraction",
        "arguments": {
            "fraction": 0.2,
            "seed": 3554237221
        }
    }
}