{
    "batch_size": 20,
    "description": "Unit test using a pretrained pytorch resnet18 model with small dataset.",
    "epochs": 5,
    "evaluation_transforms": [
        {
            "fqcn": "juneberry.transforms.image.ResizePad",
            "kwargs": {
                "height": 160,
                "width": 160
            }
        },
        {
            "fqcn": "juneberry.transforms.image.ConvertMode",
            "kwargs": {
                "mode": "RGB"
            }
        },
        {
            "fqcn": "juneberry.transforms.debugging_transforms.SizeCheckImageTransform",
            "kwargs": {
                "height": 160,
                "mode": "RGB",
                "width": 160
            }
        }
    ],
    "evaluator": {
        "fqcn": "juneberry.pytorch.evaluator.PytorchEvaluator"
    },
    "format_version": "0.2.0",
    "label_mapping": "data_sets/label_mappings/imagenet.json",
    "model_architecture": {
        "args": {
            "channels": 3,
            "img_height": 160,
            "img_width": 160,
            "num_classes": 1000
        },
        "module": "juneberry.architectures.pytorch.pytv_resnet18_pretrained_reference.ReferenceResnet18"
    },
    "platform": "pytorch",
    "pytorch": {
        "accuracy_args": {
            "normalize": true
        },
        "accuracy_fn": "sklearn.metrics.accuracy_score",
        "deterministic": true,
        "loss_fn": "torch.nn.CrossEntropyLoss",
        "lr_schedule_args": {
            "gamma": 0.5,
            "milestones": [
                3,
                5
            ]
        },
        "lr_schedule_fn": "MultiStepLR",
        "optimizer_args": {
            "lr": 0.01
        },
        "optimizer_fn": "torch.optim.SGD"
    },
    "seed": 4210592948,
    "task": "classification",
    "timestamp": "2021-03-02T13:30:00",
    "trainer": {
        "fqcn": "juneberry.pytorch.classifier_trainer.ClassifierTrainer"
    },
    "training_dataset_config_path": "data_sets/imagenette_unit_train.json",
    "training_transforms": [
        {
            "fqcn": "juneberry.transforms.image.ResizePad",
            "kwargs": {
                "height": 160,
                "width": 160
            }
        },
        {
            "fqcn": "juneberry.transforms.image.ConvertMode",
            "kwargs": {
                "mode": "RGB"
            }
        },
        {
            "fqcn": "juneberry.transforms.debugging_transforms.SizeCheckImageTransform",
            "kwargs": {
                "height": 160,
                "mode": "RGB",
                "width": 160
            }
        },
        {
            "fqcn": "torchvision.transforms.ToTensor"
        },
        {
            "fqcn": "juneberry.transforms.debugging_transforms.NoOpTensorTransform",
            "kwargs": {
                "name": "NoOpTensorTransformer"
            }
        }
    ],
    "validation": {
        "algorithm": "random_fraction",
        "arguments": {
            "fraction": 0.2,
            "seed": 3554237221
        }
    }
}